{
  "schema_version": 1,
  "contrast": "comrade_accepted_first",
  "content_root": "scenarios/fixtures/decision_core",
  "seed": 4,
  "hero": "fixture:crew_skeptic",
  "contract": "fixture:crew_job",
  "vary": { "input": "contract.accepted_by", "from": [], "to": ["fixture:crew_leader"] },
  "expect": "accept_to_decline"
}
