{
  "schema_version": 1,
  "contrast": "tag_added_that_a_trait_hates",
  "content_root": "scenarios/fixtures/decision_core",
  "seed": 3,
  "hero": "fixture:averse_hero",
  "contract": "fixture:crew_job",
  "vary": { "input": "contract.tags", "from": [], "to": ["test:gamma"] },
  "expect": "accept_to_decline"
}
